{
  "audio_mix_asset": "assets/audio/final_mix.mp3",
  "fps": 30,
  "full_duration_seconds": 757.9333333333333,
  "full_frame_count": 22738,
  "height": 1080,
  "project_id": "001-ai-race",
  "proof_boundary_frame": 5411,
  "schema_version": "1.0",
  "sections": [
    {
      "end_frame": 2526,
      "section_id": "SEC_RACE",
      "start_frame": 0,
      "title": "The Race"
    },
    {
      "end_frame": 5053,
      "section_id": "SEC_EVIDENCE",
      "start_frame": 2526,
      "title": "Controlled Evidence"
    },
    {
      "end_frame": 7579,
      "section_id": "SEC_INCENTIVE",
      "start_frame": 5053,
      "title": "Incentives"
    },
    {
      "end_frame": 10106,
      "section_id": "SEC_MISUSE",
      "start_frame": 7579,
      "title": "Misuse"
    },
    {
      "end_frame": 12632,
      "section_id": "SEC_POWER",
      "start_frame": 10106,
      "title": "Power"
    },
    {
      "end_frame": 15159,
      "section_id": "SEC_GOVERNANCE",
      "start_frame": 12632,
      "title": "Regulation"
    },
    {
      "end_frame": 17685,
      "section_id": "SEC_TRADEOFF",
      "start_frame": 15159,
      "title": "Open and Closed"
    },
    {
      "end_frame": 20212,
      "section_id": "SEC_SAFETY",
      "start_frame": 17685,
      "title": "Safety Architecture"
    },
    {
      "end_frame": 22738,
      "section_id": "SEC_FINAL",
      "start_frame": 20212,
      "title": "Human Choice"
    }
  ],
  "shots": [
    {
      "asset_ids": [
        "F1"
      ],
      "claim_ids": [
        "CLM_RACE_INCENTIVE"
      ],
      "editorial_purpose": "Establish the film’s central competitive pressure through nonliteral cinematic context.",
      "end_frame": 105,
      "evidence_claim": false,
      "eyebrow": "ORVYQ",
      "motif_id": "MOTIF_001",
      "motion": "push",
      "safe_area": {
        "bottom": 48,
        "left": 70,
        "right": 70,
        "top": 52
      },
      "shot_id": "SHOT_001",
      "shot_type": "cinematic_hook",
      "source_label": "ORVYQ · CONTEXTUAL",
      "start_frame": 0,
      "title": "THE RACE IS ALREADY MOVING",
      "transition_in": "cut",
      "transition_out": "cut",
      "trim_in_seconds": 0,
      "trim_out_seconds": 3.5,
      "typography": {
        "source_px": 17,
        "subtitle_px": 25,
        "title_px": 50
      }
    },
    {
      "asset_ids": [
        "F2"
      ],
      "claim_ids": [
        "CLM_SAFETY_FRAMEWORKS"
      ],
      "editorial_purpose": "Establish the film’s central competitive pressure through nonliteral cinematic context.",
      "end_frame": 210,
      "evidence_claim": false,
      "motif_id": "MOTIF_002",
      "motion": "drift_left",
      "safe_area": {
        "bottom": 48,
        "left": 70,
        "right": 70,
        "top": 52
      },
      "shot_id": "SHOT_002",
      "shot_type": "cinematic_hook",
      "source_label": "ORVYQ · CONTEXTUAL",
      "start_frame": 105,
      "transition_in": "cut",
      "transition_out": "cut",
      "trim_in_seconds": 0,
      "trim_out_seconds": 3.5,
      "typography": {
        "source_px": 17,
        "subtitle_px": 25,
        "title_px": 50
      }
    },
    {
      "asset_ids": [
        "F3"
      ],
      "claim_ids": [
        "CLM_SAFETY_THRESHOLDS"
      ],
      "editorial_purpose": "Establish the film’s central competitive pressure through nonliteral cinematic context.",
      "end_frame": 330,
      "evidence_claim": false,
      "motif_id": "MOTIF_003",
      "motion": "pull",
      "safe_area": {
        "bottom": 48,
        "left": 70,
        "right": 70,
        "top": 52
      },
      "shot_id": "SHOT_003",
      "shot_type": "cinematic_hook",
      "source_label": "ORVYQ · CONTEXTUAL",
      "start_frame": 210,
      "transition_in": "cut",
      "transition_out": "cut",
      "trim_in_seconds": 0,
      "trim_out_seconds": 4,
      "typography": {
        "source_px": 17,
        "subtitle_px": 25,
        "title_px": 50
      }
    },
    {
      "asset_ids": [
        "F4"
      ],
      "claim_ids": [
        "CLM_ALIGNMENT_RISK"
      ],
      "editorial_purpose": "Establish the film’s central competitive pressure through nonliteral cinematic context.",
      "end_frame": 450,
      "evidence_claim": false,
      "motif_id": "MOTIF_004",
      "motion": "drift_right",
      "safe_area": {
        "bottom": 48,
        "left": 70,
        "right": 70,
        "top": 52
      },
      "shot_id": "SHOT_004",
      "shot_type": "cinematic_hook",
      "source_label": "ORVYQ · CONTEXTUAL",
      "start_frame": 330,
      "transition_in": "cut",
      "transition_out": "cut",
      "trim_in_seconds": 0,
      "trim_out_seconds": 4,
      "typography": {
        "source_px": 17,
        "subtitle_px": 25,
        "title_px": 50
      }
    },
    {
      "asset_ids": [
        "F5"
      ],
      "claim_ids": [
        "CLM_CONTROLLED_TEST"
      ],
      "editorial_purpose": "Provide nonliteral cinematic context for anthropic reported controlled simulations in which multiple models sometimes selected harmful actions under engineered pressure.",
      "end_frame": 637,
      "evidence_claim": false,
      "motif_id": "MOTIF_005",
      "motion": "push",
      "safe_area": {
        "bottom": 48,
        "left": 70,
        "right": 70,
        "top": 52
      },
      "shot_id": "SHOT_005",
      "shot_type": "contextual_footage",
      "source_label": "ORVYQ · CONTEXTUAL",
      "start_frame": 450,
      "transition_in": "cut",
      "transition_out": "cut",
      "trim_in_seconds": 0,
      "trim_out_seconds": 6.233333,
      "typography": {
        "source_px": 17,
        "subtitle_px": 25,
        "title_px": 50
      }
    },
    {
      "callout": "This is a genuine primary-source capture linked to the current claim.",
      "claim_ids": [
        "CLM_SAFETY_FRAMEWORKS"
      ],
      "editorial_purpose": "Show genuine source pixels supporting the published simulation supplied fictional emails and an engineered replacement threat to test model behaviour.",
      "end_frame": 824,
      "evidence_ids": [
        "EVID_RSP_COVER"
      ],
      "motif_id": "MOTIF_006",
      "safe_area": {
        "bottom": 48,
        "left": 70,
        "right": 70,
        "top": 52
      },
      "shot_id": "SHOT_006",
      "shot_type": "primary_document",
      "source_label": "SRC_ANTHROPIC_RSP",
      "start_frame": 637,
      "subtitle": "The source is shown directly; the footer preserves provenance and limits.",
      "title": "Anthropic Responsible Scaling Policy cover",
      "transition_in": "cut",
      "transition_out": "cut",
      "typography": {
        "source_px": 17,
        "subtitle_px": 25,
        "title_px": 50
      }
    },
    {
      "callout": "This is a genuine primary-source capture linked to the current claim.",
      "claim_ids": [
        "CLM_SAFETY_FRAMEWORKS"
      ],
      "editorial_purpose": "Show genuine source pixels supporting institutional oversight can move more slowly than technical capability and deployment.",
      "end_frame": 1010,
      "evidence_ids": [
        "EVID_RSP_SUMMARY"
      ],
      "motif_id": "MOTIF_007",
      "safe_area": {
        "bottom": 48,
        "left": 70,
        "right": 70,
        "top": 52
      },
      "shot_id": "SHOT_007",
      "shot_type": "official_figure",
      "source_label": "SRC_ANTHROPIC_RSP",
      "start_frame": 824,
      "subtitle": "The source is shown directly; the footer preserves provenance and limits.",
      "title": "Anthropic RSP commitments and governance summary",
      "transition_in": "cut",
      "transition_out": "cut",
      "typography": {
        "source_px": 17,
        "subtitle_px": 25,
        "title_px": 50
      }
    },
    {
      "asset_ids": [
        "F6"
      ],
      "claim_ids": [
        "CLM_MISUSE"
      ],
      "editorial_purpose": "Provide nonliteral cinematic context for more capable and accessible systems can lower barriers for some forms of cyber or biological misuse while also aiding defenders.",
      "end_frame": 1196,
      "evidence_claim": false,
      "motif_id": "MOTIF_008",
      "motion": "drift_right",
      "safe_area": {
        "bottom": 48,
        "left": 70,
        "right": 70,
        "top": 52
      },
      "shot_id": "SHOT_008",
      "shot_type": "contextual_footage",
      "source_label": "ORVYQ · CONTEXTUAL",
      "start_frame": 1010,
      "transition_in": "cut",
      "transition_out": "cut",
      "trim_in_seconds": 0,
      "trim_out_seconds": 6.2,
      "typography": {
        "source_px": 17,
        "subtitle_px": 25,
        "title_px": 50
      }
    },
    {
      "claim_ids": [
        "CLM_POWER"
      ],
      "editorial_purpose": "Translate the sourced argument into an explicit source-derived visual model.",
      "end_frame": 1382,
      "items": [
        {
          "label": "CAPABILITY",
          "value": "More powerful systems"
        },
        {
          "label": "INCENTIVE",
          "value": "Faster competitive movement"
        },
        {
          "label": "CONTROL",
          "value": "Governance must catch up"
        }
      ],
      "motif_id": "MOTIF_009",
      "safe_area": {
        "bottom": 48,
        "left": 70,
        "right": 70,
        "top": 52
      },
      "shot_id": "SHOT_009",
      "shot_type": "source_derived_graphic",
      "source_label": "SRC_UNESCO_ETHICS · SRC_EU_AI_ACT",
      "start_frame": 1196,
      "title": "THE PRESSURE COMPOUNDS",
      "transition_in": "cut",
      "transition_out": "cut",
      "typography": {
        "source_px": 17,
        "subtitle_px": 25,
        "title_px": 50
      }
    },
    {
      "claim_ids": [
        "CLM_OPEN_CLOSED"
      ],
      "editorial_purpose": "State the source boundary before advancing the argument.",
      "end_frame": 1568,
      "left": "Open and closed development strategies create different security, accountability and concentration trade-offs.",